{
  "$schema": "https://json-schema.org/draft/2020-12/schema",
  "$id": "urn:contextualwisdomlab:learning-interoperability-contracts:cefr-language-assessment:assessment-blueprint:1.0.0",
  "x-cwl-schema-version": "1.0.0",
  "title": "CWL CEFR Language Assessment Blueprint v1",
  "description": "A rights-safe, version-pinned assessment blueprint. It references CEFR, target-language profile/RLD, and scientific artifacts and never embeds official descriptor prose.",
  "type": "object",
  "additionalProperties": false,
  "required": [
    "contract_version",
    "blueprint_reference",
    "framework_version_reference",
    "language_reference_level_description_reference",
    "language_reference_level_description_revision",
    "descriptor_source_policy_code",
    "target_language",
    "assessment_purpose_code",
    "decision_stakes_code",
    "reporting_scope_code",
    "supported_level_codes",
    "required_domain_codes",
    "instrument_release_reference",
    "scoring_profile_reference",
    "cut_score_revision_reference",
    "validation_evidence_references",
    "published_at"
  ],
  "properties": {
    "contract_version": {"const": "cwl_cefr_language_assessment/assessment_blueprint/v1"},
    "blueprint_reference": {"$ref": "urn:contextualwisdomlab:learning-interoperability-contracts:cefr-language-assessment:cefr-common:1.0.0#/$defs/opaque_reference"},
    "framework_version_reference": {"$ref": "urn:contextualwisdomlab:learning-interoperability-contracts:cefr-language-assessment:cefr-common:1.0.0#/$defs/opaque_reference"},
    "language_reference_level_description_reference": {
      "description": "Exact authority/source identity for the target-language RLD or language-profile source.",
      "$ref": "urn:contextualwisdomlab:learning-interoperability-contracts:cefr-language-assessment:cefr-common:1.0.0#/$defs/opaque_reference"
    },
    "language_reference_level_description_revision": {
      "description": "Immutable publisher revision, edition, digest-bound snapshot, or dated registry snapshot. A mutable latest alias is prohibited.",
      "$ref": "urn:contextualwisdomlab:learning-interoperability-contracts:cefr-language-assessment:cefr-common:1.0.0#/$defs/opaque_reference"
    },
    "descriptor_source_policy_code": {"const": "reference_only_no_descriptor_copy"},
    "target_language": {"$ref": "urn:contextualwisdomlab:learning-interoperability-contracts:cefr-language-assessment:cefr-common:1.0.0#/$defs/language_tag"},
    "assessment_purpose_code": {
      "type": "string",
      "enum": ["placement", "diagnostic", "progress_monitoring", "certification", "research"]
    },
    "decision_stakes_code": {"type": "string", "enum": ["low", "moderate", "high"]},
    "reporting_scope_code": {"type": "string", "enum": ["profile_only", "overall_and_profile"]},
    "supported_level_codes": {
      "type": "array",
      "minItems": 2,
      "maxItems": 10,
      "uniqueItems": true,
      "items": {"$ref": "urn:contextualwisdomlab:learning-interoperability-contracts:cefr-language-assessment:cefr-common:1.0.0#/$defs/cefr_level_code"}
    },
    "required_domain_codes": {
      "type": "array",
      "minItems": 1,
      "maxItems": 12,
      "uniqueItems": true,
      "items": {"$ref": "urn:contextualwisdomlab:learning-interoperability-contracts:cefr-language-assessment:cefr-common:1.0.0#/$defs/activity_domain_code"}
    },
    "optional_domain_codes": {
      "type": "array",
      "maxItems": 12,
      "uniqueItems": true,
      "items": {"$ref": "urn:contextualwisdomlab:learning-interoperability-contracts:cefr-language-assessment:cefr-common:1.0.0#/$defs/activity_domain_code"}
    },
    "instrument_release_reference": {"$ref": "urn:contextualwisdomlab:learning-interoperability-contracts:cefr-language-assessment:cefr-common:1.0.0#/$defs/opaque_reference"},
    "scoring_profile_reference": {"$ref": "urn:contextualwisdomlab:learning-interoperability-contracts:cefr-language-assessment:cefr-common:1.0.0#/$defs/opaque_reference"},
    "cut_score_revision_reference": {"$ref": "urn:contextualwisdomlab:learning-interoperability-contracts:cefr-language-assessment:cefr-common:1.0.0#/$defs/opaque_reference"},
    "overall_reporting_policy_reference": {
      "description": "Immutable policy that alone authorizes and defines any overall result for this blueprint.",
      "$ref": "urn:contextualwisdomlab:learning-interoperability-contracts:cefr-language-assessment:cefr-common:1.0.0#/$defs/opaque_reference"
    },
    "standard_setting_study_reference": {"$ref": "urn:contextualwisdomlab:learning-interoperability-contracts:cefr-language-assessment:cefr-common:1.0.0#/$defs/opaque_reference"},
    "validation_evidence_references": {
      "type": "array",
      "minItems": 1,
      "maxItems": 256,
      "uniqueItems": true,
      "items": {"$ref": "urn:contextualwisdomlab:learning-interoperability-contracts:cefr-language-assessment:cefr-common:1.0.0#/$defs/opaque_reference"}
    },
    "published_at": {"$ref": "urn:contextualwisdomlab:learning-interoperability-contracts:cefr-language-assessment:cefr-common:1.0.0#/$defs/date_time"},
    "limitations": {
      "type": "array",
      "maxItems": 64,
      "uniqueItems": true,
      "items": {"type": "string", "minLength": 3, "maxLength": 256}
    }
  },
  "allOf": [
    {
      "if": {
        "properties": {"reporting_scope_code": {"const": "overall_and_profile"}},
        "required": ["reporting_scope_code"]
      },
      "then": {"required": ["overall_reporting_policy_reference"]}
    },
    {
      "if": {
        "anyOf": [
          {
            "properties": {"decision_stakes_code": {"const": "high"}},
            "required": ["decision_stakes_code"]
          },
          {
            "properties": {"assessment_purpose_code": {"const": "certification"}},
            "required": ["assessment_purpose_code"]
          }
        ]
      },
      "then": {"required": ["standard_setting_study_reference"]}
    }
  ]
}
