{
  "contract_version": "cwl_cefr_language_assessment/assessment_blueprint/v1",
  "blueprint_reference": "cefr_en_placement_a1_b2_overall_blueprint_v1",
  "framework_version_reference": "coe_cefr_companion_volume_2020",
  "language_reference_level_description_reference": "coe_rld_registry_english_profile",
  "language_reference_level_description_revision": "english_profile_registry_snapshot_2026_08_27",
  "descriptor_source_policy_code": "reference_only_no_descriptor_copy",
  "target_language": "en",
  "assessment_purpose_code": "placement",
  "decision_stakes_code": "low",
  "reporting_scope_code": "overall_and_profile",
  "supported_level_codes": ["a1", "a2", "b1", "b2"],
  "required_domain_codes": [
    "reading_reception",
    "listening_reception",
    "written_production",
    "spoken_production"
  ],
  "optional_domain_codes": ["spoken_interaction", "mediating_text"],
  "instrument_release_reference": "instrument_release_en_placement_v1",
  "scoring_profile_reference": "scoring_profile_en_placement_v1",
  "cut_score_revision_reference": "cut_score_revision_en_placement_v1",
  "overall_reporting_policy_reference": "overall_reporting_policy_en_v1",
  "validation_evidence_references": [
    "content_validation_study_en_v1",
    "pilot_recovery_study_en_v1",
    "rater_calibration_study_en_v1"
  ],
  "published_at": "2026-08-27T10:00:00Z",
  "limitations": [
    "No certification use.",
    "English Profile is pinned as a dated registry snapshot because the public registry exposes no single immutable edition identifier.",
    "No mediation or interaction claim unless separately measured."
  ]
}
